{
  "$schema": "https://json-schema.org/draft/2020-12/schema",
  "$id": "https://arcantry.dev/schemas/skill-metadata.schema.json",
  "title": "Arcantry skill metadata",
  "type": "object",
  "additionalProperties": false,
  "required": ["$schema", "version", "role", "summary", "scenarios"],
  "properties": {
    "$schema": {
      "const": "../../schemas/skill-metadata.schema.json"
    },
    "version": {
      "type": "string",
      "pattern": "^(0|[1-9][0-9]*)\\.(0|[1-9][0-9]*)\\.(0|[1-9][0-9]*)(?:-[0-9A-Za-z.-]+)?(?:\\+[0-9A-Za-z.-]+)?$"
    },
    "role": {
      "enum": ["primary", "supporting", "advanced"]
    },
    "summary": {
      "type": "string",
      "minLength": 30,
      "maxLength": 180
    },
    "compatibility": {
      "type": "object",
      "additionalProperties": false,
      "required": ["sourceKinds"],
      "properties": {
        "sourceKinds": {
          "type": "array",
          "minItems": 1,
          "uniqueItems": true,
          "items": {
            "enum": ["openspec", "changelog", "todo-txt"]
          }
        },
        "adapters": {
          "type": "array",
          "uniqueItems": true,
          "items": {
            "type": "object",
            "additionalProperties": false,
            "required": ["name", "versions"],
            "properties": {
              "name": {
                "type": "string",
                "pattern": "^[a-z][a-z0-9-]*$"
              },
              "versions": {
                "type": "string",
                "minLength": 1
              }
            }
          }
        }
      }
    },
    "learning": {
      "type": "object",
      "additionalProperties": false,
      "required": ["outcomes"],
      "properties": {
        "prerequisites": {
          "type": "array",
          "minItems": 1,
          "items": {
            "type": "string",
            "minLength": 5,
            "maxLength": 160
          }
        },
        "outcomes": {
          "type": "array",
          "minItems": 1,
          "items": {
            "type": "string",
            "minLength": 5,
            "maxLength": 160
          }
        }
      }
    },
    "scenarios": {
      "type": "array",
      "minItems": 2,
      "maxItems": 2,
      "items": {
        "type": "object",
        "additionalProperties": false,
        "required": ["title", "prompt", "outcome"],
        "properties": {
          "title": {
            "type": "string",
            "minLength": 5,
            "maxLength": 60
          },
          "prompt": {
            "type": "string",
            "minLength": 15,
            "maxLength": 280
          },
          "outcome": {
            "type": "string",
            "minLength": 15,
            "maxLength": 220
          }
        }
      }
    }
  }
}
