{
  "$schema": "../../schemas/skill-metadata.schema.json",
  "version": "1.0.0",
  "role": "primary",
  "summary": "Group selected todo.txt items into privacy-safe OpenSpec transformations and hold every proposed change for approval.",
  "compatibility": {
    "sourceKinds": ["openspec", "todo-txt"]
  },
  "learning": {
    "outcomes": [
      "Classify todo.txt items before deciding whether they belong in OpenSpec.",
      "Propose zero-to-many and many-to-many transformations without losing operational or private work."
    ]
  },
  "scenarios": [
    {
      "title": "Review a mixed todo queue",
      "prompt": "Use the promote-todo-to-openspec skill to classify this todo.txt and propose separate transformations for my approval before changing files.",
      "outcome": "Every item is accounted for while operational, unclear, private, and sensitive work remains outside shared specifications."
    },
    {
      "title": "Consolidate overlapping product intent",
      "prompt": "Use the promote-todo-to-openspec skill to map these overlapping todo.txt entries into existing or new OpenSpec changes without assuming one-to-one promotion.",
      "outcome": "A coverage ledger presents merge, split, relocation, and preservation choices that can be accepted independently."
    }
  ]
}
