{
  "$schema": "../../schemas/skill-metadata.schema.json",
  "version": "1.0.0",
  "role": "advanced",
  "summary": "Build one focused skill candidate from recurring conversation evidence and evaluate it behind explicit approval gates.",
  "scenarios": [
    {
      "title": "Create a skill from recent work",
      "prompt": "Use the forge-skill-from-conversations skill on these selected completed tasks and propose one reusable skill candidate.",
      "outcome": "One evidence-backed candidate, a stop for approval, an isolated implementation, and held-out evaluation before adoption."
    },
    {
      "title": "Use supplied conversation evidence",
      "prompt": "Use the forge-skill-from-conversations skill on this transcript. Do not scan other tasks or install anything without asking.",
      "outcome": "A privacy-scoped skill-forging flow that preserves separate approval for the candidate and its installation."
    }
  ]
}
