{
  "$schema": "../../schemas/skill-metadata.schema.json",
  "version": "1.0.0",
  "role": "supporting",
  "summary": "Choose a small set of available skills whose non-overlapping workflows materially improve a complex task.",
  "scenarios": [
    {
      "title": "Route a multi-domain task",
      "prompt": "Use the select-task-skills skill for this repository task and choose no more than three skills that materially improve it.",
      "outcome": "A short use-now or install-first selection based on actual triggers, with overlapping candidates omitted."
    },
    {
      "title": "Discover project-local skills",
      "prompt": "Use the select-task-skills skill to check whether this project declares a skill for the unfamiliar workflow I requested.",
      "outcome": "A catalog-backed recommendation that does not install, enable, update, or remove any skill."
    }
  ]
}
