{
  "$schema": "../../schemas/skill-metadata.schema.json",
  "version": "1.0.0",
  "role": "primary",
  "summary": "Write concrete reader-facing product content from verified evidence without private leakage or internal process narration.",
  "learning": {
    "outcomes": [
      "Turn authoritative product facts into concise audience-directed content.",
      "Remove unsupported claims, generic filler, repetition, and private context leakage."
    ]
  },
  "scenarios": [
    {
      "title": "Rewrite product documentation",
      "prompt": "Use the write-product-content skill to revise this documentation for developers while preserving its approved structure and presentation.",
      "outcome": "The content leads with developer outcomes, uses verified commands, and removes process-centered filler."
    },
    {
      "title": "Prepare concise release copy",
      "prompt": "Use the write-product-content skill to turn these verified release facts into concise consumer-facing copy.",
      "outcome": "The release text states concrete user impact without commit narration or unsupported significance."
    }
  ]
}
