{
  "$schema": "../../schemas/skill-metadata.schema.json",
  "version": "1.0.0",
  "role": "primary",
  "summary": "Adopt the smallest useful Arcantry boundary while preserving repository-owned tooling, knowledge sources, and private state.",
  "compatibility": {
    "sourceKinds": ["openspec", "changelog", "todo-txt"],
    "adapters": [
      { "name": "openspec", "versions": ">=1 <2" },
      { "name": "keep-a-changelog", "versions": ">=1 <3" },
      { "name": "todo-txt", "versions": ">=1 <2" }
    ]
  },
  "learning": {
    "prerequisites": [
      "Identify the project root and any private configuration supplied by the user."
    ],
    "outcomes": [
      "Distinguish discovery, footprint, and management for each project source.",
      "Choose an explicit preservation or source transition boundary without automatic conversion.",
      "Keep local state private unless the default remote branch establishes a different repository policy.",
      "Prefer user-wide skills and make repository-private packages an explicit fallback."
    ]
  },
  "scenarios": [
    {
      "title": "Adopt Arcantry in a mature repository",
      "prompt": "Use the adopt-arcantry skill to inspect a mature repository and plan selective adoption while preserving existing tooling and knowledge sources.",
      "outcome": "A source-by-source adoption plan that leaves project-owned files unchanged until explicitly applied."
    },
    {
      "title": "Diagnose an existing adoption",
      "prompt": "Use the adopt-arcantry skill to inspect and validate this repository without removing unknown files or changing external systems.",
      "outcome": "A repository health report backed by Arcantry validation and doctor checks, with private state kept local."
    }
  ]
}
