{
  "$schema": "../../schemas/skill-metadata.schema.json",
  "version": "1.0.0",
  "role": "advanced",
  "summary": "Extract repeated workflow friction from conversation evidence and propose the smallest durable carrier without implementing it.",
  "scenarios": [
    {
      "title": "Find repeated manual work",
      "prompt": "Use the capture-repeatable-work skill on my five recent completed project tasks and find recurring manual verification steps.",
      "outcome": "A small set of evidence-backed candidates routed to the narrowest useful instruction, script, skill, or automation."
    },
    {
      "title": "Assess one expensive workflow",
      "prompt": "Use the capture-repeatable-work skill on this conversation and decide whether the workflow is stable enough to productize.",
      "outcome": "A read-only candidate or a clear rejection when the evidence shows only an isolated lapse or transient incident."
    }
  ]
}
